{
  "schema_version": "1.0.0",
  "record_type": "activity_item",
  "id": "autologous-mt-cardiac-ecmo-trial-recruiting",
  "name": "Autologous mitochondrial transplantation ECMO trial launched",
  "summary": "A Boston Children's Hospital registry opened a human trial of autologous mitochondrial transplantation after ischemia in pediatric ECMO patients.",
  "activity_type": "trial_launch",
  "activity_lane": "scientific",
  "occurred_on": "2016-08-02",
  "trial_activity_kind": "new_direct_human_trial",
  "source_ids": [
    "nct-02851758"
  ],
  "external_urls": [
    "https://clinicaltrials.gov/study/NCT02851758"
  ],
  "hallmark_ids": [
    "mitochondrial_dysfunction"
  ],
  "noteworthiness_tier": "material_program",
  "threshold_basis": [
    "clinical_transition",
    "direct_track_relevance"
  ],
  "track_ids": [
    "mitochondrial-delivery-and-transplantation"
  ],
  "intervention_ids": [
    "autologous-mitochondrial-transplantation"
  ],
  "significance_note": "Shows the method has reached a human clinical setting. It still does not answer the aging question because this is an acute pediatric ECMO study with no posted results.",
  "affects_outlook": false,
  "tags": [
    "public",
    "mitochondrial-delivery-and-transplantation",
    "autologous-mitochondrial-transplantation",
    "trial-watch"
  ]
}
